{
  "confidence": 0.8,
  "content_sha256": "821e6139a85ce1e7b7f1c8d23cc0fd366d7fe1753aa51d477f20874f8edade6b",
  "file": "content/cat-15-data-center-physical-infrastructure/UC-15.3.32.json",
  "findings": [
    {
      "confidence": 0.8,
      "dimension": "correctness",
      "evidence_url": "https://docs.splunk.com/Documentation/CIM/latest/User/Authentication",
      "explanation": "Wireless presence and dwell time are not login events; the Authentication model describes authentication attempts, so nothing in this feed maps to it. dataModelAcceleration ('Enable for Authentication') repeats the mistake.",
      "field": "cimModels",
      "quote": "Authentication",
      "severity": "blocker",
      "suggested_fix": "Use an empty cimModels list, or a model that fits presence events if one is identified."
    },
    {
      "confidence": 0.8,
      "dimension": "correctness",
      "evidence_ref": "data/splunkbase-catalog.json",
      "explanation": "The catalog lists Splunkbase 1352 as 'App for Cisco Network Data' (cisco_ios), not a Cisco Security add-on, and it is unrelated to Cisco Spaces.",
      "field": "references",
      "quote": "Splunk Add-on for Cisco Security (Splunkbase 1352)",
      "severity": "blocker",
      "suggested_fix": "Replace with the Spaces Add-On for Splunk (8485), which is already referenced, or remove this entry."
    },
    {
      "confidence": 0.85,
      "dimension": "consistency",
      "explanation": "These are engagement labels (High, Medium, Low, Pass-through), not alert conditions; the SPL is a ranking report and nothing alerts.",
      "field": "description",
      "quote": "with thresholds `dwell_min` > 0, `avg_dwell` > 30, `avg_dwell` > 10, or `avg_dwell` > 2",
      "severity": "major",
      "suggested_fix": "Describe the search as a per-zone dwell summary with an engagement label."
    },
    {
      "confidence": 0.8,
      "dimension": "consistency",
      "explanation": "The SPL keeps all dwell_min > 0 and labels short dwell 'Pass-through' instead of filtering; no search sequences location updates, so the Sankey movement-flow visualization has no data.",
      "field": "implementation",
      "quote": "Filter out devices with dwell times under 2 minutes to exclude pass-throughs. Build movement flow analysis by sequencing location updates per device MAC.",
      "severity": "major",
      "suggested_fix": "Align the text with the SPL, or add a movement-flow search; drop the Sankey otherwise."
    },
    {
      "confidence": 0.5,
      "dimension": "correctness",
      "explanation": "Event timing and the exitTime/entryTime field names used by the SPL are not confirmed; Cisco Spaces presence events may use different field names and timestamp formats, which would break the epoch subtraction.",
      "field": "implementation",
      "quote": "Device presence events fire at entry, after 10 minutes of inactivity, and at exit.",
      "severity": "needs_verification",
      "suggested_fix": "Check a real DEVICE_PRESENCE event for the field names and formats."
    },
    {
      "confidence": 0.6,
      "dimension": "specificity",
      "explanation": "Validation step is copied from an access-control use case; the text also wanders into retail and healthcare, and says nothing about the privacy of tracking device MAC addresses.",
      "field": "detailedImplementation",
      "quote": "Compare with the badge reader and access control system for the same doors, events, and time range.",
      "severity": "minor",
      "suggested_fix": "Validate against the Cisco Spaces dashboard and add a privacy note for MAC-level tracking."
    }
  ],
  "firewalled_field_flags": [
    {
      "field": "cimSpl",
      "issue": "tstats on Authentication.Authentication by user, action, src has no relation to dwell time or zone presence.",
      "severity": "major"
    },
    {
      "field": "title",
      "issue": "'Movement Flow Analysis' is not delivered by the SPL, which only summarizes dwell time per zone.",
      "severity": "major"
    }
  ],
  "model": "claude-sonnet-5-5@reasoning=high",
  "reviewed_at": "2026-10-26T16:53:11Z",
  "rubric_version": "1.0",
  "run_id": "file:triage-0011-UC-15.3.28",
  "schema_version": "1.0",
  "scores": {
    "clarity": 2,
    "consistency": 2,
    "correctness": 1,
    "grandma_fidelity": 2,
    "overclaiming": 3,
    "specificity": 2
  },
  "summary": "A dwell-time report mapped to the Authentication data model, with a reference to the wrong Splunkbase app, and prose that describes movement-flow and thresholds the SPL does not implement.",
  "tier": "triage",
  "uc_id": "UC-15.3.32",
  "verdict": "incorrect"
}
