{
  "confidence": 0.8,
  "content_sha256": "6d77cd442dbc4b2204a269dbfb5ae881281fb92f1e39a2cc72051afcd57417d2",
  "file": "content/cat-15-data-center-physical-infrastructure/UC-15.2.14.json",
  "findings": [
    {
      "confidence": 0.8,
      "dimension": "consistency",
      "explanation": "The SPL searches only `bms:cooling_capacity` and reads `it_load_kw` from it. The IT power sourcetype is never joined, appended or looked up, so the stated two-feed design is not implemented.",
      "field": "dataSources",
      "quote": "`sourcetype=\"power:it_heat\"`",
      "severity": "major",
      "suggested_fix": "Either add the join to `power:it_heat` or explain that `it_load_kw` is already present on the BMS events."
    },
    {
      "confidence": 0.85,
      "dimension": "consistency",
      "explanation": "The SPL compares the margin to 15% of current IT heat (`it_heat_tons * 0.15`), not a peak load forecast, and no forecast exists in the SPL.",
      "field": "implementation",
      "quote": "Alert when margin <15% of peak load forecast.",
      "severity": "major",
      "suggested_fix": "Say 15% of the current IT heat load, or add the forecast."
    },
    {
      "confidence": 0.85,
      "dimension": "consistency",
      "explanation": "The SPL does no aggregation and groups by nothing. It evaluates each event's capacity margin against 15% of IT heat.",
      "field": "description",
      "quote": "by aggregating `count` grouped by `entity` over `the scheduled window` and alerting when configured threshold",
      "severity": "major",
      "suggested_fix": "Describe the margin rule and that rows are per zone reading."
    },
    {
      "confidence": 0.75,
      "dimension": "specificity",
      "explanation": "Boilerplate. The Universal Forwarder is not a Splunkbase app and neither the BMS nor the power meter interface is named.",
      "field": "dataSources",
      "quote": "Collected via Universal Forwarder (Splunkbase 617) modular input or scripted poll into the index named in the SPL.",
      "severity": "major",
      "suggested_fix": "Name the BMS and power metering sources."
    },
    {
      "confidence": 0.6,
      "dimension": "correctness",
      "explanation": "This validates only the power side. The cooling capacity and output values, which drive the margin, are not covered.",
      "field": "detailedImplementation",
      "quote": "Compare with the PDU UI or SNMP poll for the same devices, readings, and time range.",
      "severity": "minor",
      "suggested_fix": "Add a check against the BMS cooling capacity and output display."
    },
    {
      "confidence": 0.8,
      "dimension": "consistency",
      "explanation": "`user` and `action` are not cooling fields. The SPL uses `zone` and the tonnage fields.",
      "field": "detailedImplementation",
      "quote": "Spot-check two known entities for field presence (`host, user, action`).",
      "severity": "minor",
      "suggested_fix": "List the tonnage fields."
    },
    {
      "confidence": 0.8,
      "dimension": "clarity",
      "explanation": "The heading is repeated four times and two overlapping procedures are concatenated.",
      "field": "detailedImplementation",
      "quote": "Step 4 — Operationalize\nStep 4 — Operationalize\nStep 4 — Operationalize\nStep 4 — Operationalize",
      "severity": "major",
      "suggested_fix": "Merge into one procedure."
    },
    {
      "confidence": 0.7,
      "dimension": "correctness",
      "evidence_url": "https://docs.splunk.com/Documentation/Splunk/latest/Admin/HowSplunklicensingworks",
      "explanation": "Search-time filters do not change Splunk licence usage.",
      "field": "detailedImplementation",
      "quote": "filters in the first pipeline reduce license cost",
      "severity": "minor",
      "suggested_fix": "Say early filters make the search faster."
    },
    {
      "confidence": 0.65,
      "dimension": "specificity",
      "explanation": "Generic Splunk pages. Nothing supports the kW to tons conversion or the capacity margin rule.",
      "field": "references",
      "quote": "Splunk HTTP Event Collector",
      "severity": "major",
      "suggested_fix": "Cite a source for the conversion and margin criterion."
    }
  ],
  "firewalled_field_flags": [
    {
      "field": "spl",
      "issue": "UC-15.2.6 uses the same `bms:cooling_capacity` sourcetype with `cooling_output_kw` and `cooling_capacity_kw`, while this SPL uses `cooling_output_tons` and `cooling_capacity_tons`. Confirm which fields and units the feed really carries. The two UCs also overlap in purpose.",
      "severity": "needs_verification"
    },
    {
      "field": "spl",
      "issue": "`it_load_kw * 0.284345` is a correct kW to tons-of-refrigeration factor. `margin_tons` is capacity minus current cooling output rather than capacity minus IT heat, so the margin measures unused cooling, not headroom over IT load.",
      "severity": "minor"
    }
  ],
  "model": "claude-sonnet-5-5@reasoning=high",
  "reviewed_at": "2026-10-26T16:53:11Z",
  "rubric_version": "1.0",
  "run_id": "file:triage-0006-UC-15.2.9",
  "schema_version": "1.0",
  "scores": {
    "clarity": 2,
    "consistency": 2,
    "correctness": 3,
    "grandma_fidelity": 2,
    "overclaiming": 3,
    "specificity": 2
  },
  "summary": "A useful margin check, but the second data source it names is never queried, the text describes a peak-load forecast the SPL does not use, and field names differ from the sibling capacity UC.",
  "tier": "triage",
  "uc_id": "UC-15.2.14",
  "verdict": "rewrite"
}
