{
  "confidence": 0.85,
  "content_sha256": "d00895b4532875c42a3c3b2754cd0872a2f4974a8573b1dc19767d44c084c527",
  "file": "content/cat-21-industry-verticals/UC-21.3.43.json",
  "findings": [
    {
      "confidence": 0.85,
      "dimension": "clarity",
      "explanation": "The title is restated and no overrun is defined. It does not say which HL7 messages carry scheduled and actual OR times, or what counts as an overrun.",
      "field": "description",
      "quote": "Monitors operating room schedule overrun analytics using `hl7:message` telemetry in `index=healthcare` to surface operational risk before it impacts healthcare and life sciences service delivery.",
      "severity": "major",
      "suggested_fix": "Define the overrun, for example actual case end minus scheduled end greater than N minutes, and name the HL7 message type or source that carries both timestamps."
    },
    {
      "confidence": 0.8,
      "dimension": "consistency",
      "explanation": "The SPL counts HL7 messages per message_type. No schedule or overrun logic exists, `event_count > 0` is always true, and the table lists fields (_time, sending_facility, receiving_facility, status) that stats has already dropped. detailedImplementation Step 2 shows yet another search, grouped by hour.",
      "field": "cross_field",
      "quote": "| stats count as event_count dc(host) as distinct_assets by message_type\n| where event_count > 0\n| table _time message_type sending_facility receiving_facility status",
      "severity": "major",
      "suggested_fix": "Rewrite the detection around scheduled versus actual OR times, then align the description, Step 2 and the table fields. Make the prose match the SPL."
    },
    {
      "confidence": 0.7,
      "dimension": "specificity",
      "explanation": "No fields are listed, and generic `hl7:message` events are not the siblings' OR source. The sibling UC-21.3.13 (Surgical Suite Utilization and Turnover Monitoring) uses `or:schedule` with `case_start` and `case_end`, so the two UCs overlap.",
      "field": "dataSources",
      "quote": "`index=healthcare` `sourcetype=hl7:message`",
      "severity": "major",
      "suggested_fix": "List the HL7 fields (for example SIU segments) and times used. Explain how this UC differs from UC-21.3.13, or merge it with that UC."
    },
    {
      "confidence": 0.7,
      "dimension": "correctness",
      "evidence_ref": "docs/guides/industry-verticals.md",
      "explanation": "Splunk OT Intelligence (5180) is an industrial/OT app, and the subcategory 21.3 lists custom HEC inputs from EHR and HL7 engines, not 5180, as the primary source. The `app` field says custom HEC inputs, so the fields disagree. The SPL needs no premium app. The same OT app is also used as the first reference.",
      "field": "app",
      "quote": "\"splunkbaseApps\": [ { \"id\": 5180, \"name\": \"Splunk OT Intelligence\", \"role\": \"primary\"",
      "severity": "major",
      "suggested_fix": "Remove 5180 as primary and from the references, and list the real HL7 interface-engine/HEC ingest path. Use a healthcare-relevant reference."
    },
    {
      "confidence": 0.8,
      "dimension": "specificity",
      "explanation": "Cross-vertical template text naming SCADA, POS and OSS in a healthcare UC. Step 1 also says ingest via 'HEC or Edge Hub', which is not how HL7 interface engines normally send data. 'Applies `*`' is residue as well.",
      "field": "detailedImplementation",
      "quote": "Compare result counts to the source system UI (SCADA HMI, EHR interface engine, POS gateway, OSS/BSS console, etc.) for the same time range.",
      "severity": "major",
      "suggested_fix": "Name the OR scheduling system or interface engine to compare against, and remove the other verticals and the `*`."
    },
    {
      "confidence": 0.6,
      "dimension": "grandma_fidelity",
      "explanation": "The title is repeated as if it were a thing to watch for, so the sentence says little to a layperson.",
      "field": "grandmaExplanation",
      "quote": "signs of operating room schedule overrun analytics",
      "severity": "minor",
      "suggested_fix": "Say that it checks whether operations in the operating rooms are running past their planned time."
    },
    {
      "confidence": 0.7,
      "dimension": "specificity",
      "explanation": "Generic text unrelated to OR overruns. Real causes would be emergency add-on cases, surgical complexity, late patient arrival or corrected HL7 messages.",
      "field": "knownFalsePositives",
      "quote": "Planned maintenance windows, vendor pack updates, DR exercises, and seasonal demand patterns excluded via asset/schedule lookup.",
      "severity": "major",
      "suggested_fix": "Name causes that apply to operating room scheduling."
    }
  ],
  "firewalled_field_flags": [
    {
      "field": "spl",
      "issue": "The SPL does not compute any OR schedule overrun. `where event_count > 0` is always true, and the table lists fields that stats has already dropped.",
      "severity": "major"
    },
    {
      "field": "mitreAttack",
      "issue": "T1078 (Valid Accounts) has no link to operating room schedule overrun analytics.",
      "severity": "major"
    }
  ],
  "model": "claude-sonnet-5-5@reasoning=high",
  "reviewed_at": "2026-10-26T16:38:22Z",
  "rubric_version": "1.0",
  "run_id": "file:triage-0032-UC-21.3.18",
  "schema_version": "1.0",
  "scores": {
    "clarity": 2,
    "consistency": 1,
    "correctness": 3,
    "grandma_fidelity": 3,
    "overclaiming": 2,
    "specificity": 1
  },
  "summary": "Pure template. Nothing in the SPL, data sources or prose computes or explains an operating room schedule overrun. The app and reference are the OT Intelligence app, which is unrelated to HL7 healthcare data.",
  "tier": "triage",
  "uc_id": "UC-21.3.43",
  "verdict": "rewrite"
}
