{
  "confidence": 0.75,
  "content_sha256": "c2fb8b58cf24ec4b4509c6629f91f4bdee5f1482b9942582d2a3dc84974f4a6d",
  "file": "content/cat-15-data-center-physical-infrastructure/UC-15.1.31.json",
  "findings": [
    {
      "confidence": 0.85,
      "dimension": "consistency",
      "explanation": "The SPL has no stats, no `entity` grouping, no count and no threshold. It lists every matching trap row.",
      "field": "description",
      "quote": "Outputs `count` each `the scheduled window`; alert when configured threshold.",
      "severity": "major",
      "suggested_fix": "Say that each row is one APC trap or cooling poll event whose text matches the cooling, compressor, fan or airflow keywords."
    },
    {
      "confidence": 0.85,
      "dimension": "clarity",
      "explanation": "The filter is cut off mid-word at 'InRow O', and the same truncated text is copied into controlTest and knownFalsePositives.",
      "field": "description",
      "quote": "Filter chain includes filter `cooling OR compressor OR Compressor OR fan OR Fan OR InRow O`.",
      "severity": "minor",
      "suggested_fix": "Quote the full filter or describe it in words, and fix the copies."
    },
    {
      "confidence": 0.5,
      "dimension": "correctness",
      "explanation": "`coolingUnitState` is not a name recognised from the APC InRow MIB branch. Check the actual object names for InRow compressor and fan alarms in the APC cooling MIB.",
      "field": "dataSources",
      "quote": "cooling varbinds such as `coolingUnitState`",
      "severity": "needs_verification",
      "suggested_fix": "Replace with the exact object names from the vendor MIB and their value enumerations."
    },
    {
      "confidence": 0.5,
      "dimension": "correctness",
      "explanation": "Check the SC4SNMP documentation for these option names and for the `trapoid`, `trap_name` and `eventName` fields. Also confirm SC4SNMP can be hosted on a Heavy Forwarder as the prerequisites say, and that it emits `snmp:trap`.",
      "field": "detailedImplementation",
      "quote": "Enable rich parsing (`full_json`, `VARBINDS`, or equivalent)",
      "severity": "needs_verification",
      "suggested_fix": "Use the documented SC4SNMP trap configuration and the sourcetype and field names it actually produces."
    },
    {
      "confidence": 0.55,
      "dimension": "correctness",
      "explanation": "`splunk_admin` is not a default Splunk role name; on Splunk Enterprise it is `admin` and on Splunk Cloud `sc_admin`.",
      "field": "detailedImplementation",
      "quote": "use a `splunk_admin` (or deployment-manager equivalent) principal",
      "severity": "minor",
      "suggested_fix": "Name the built-in admin role for each platform."
    },
    {
      "confidence": 0.65,
      "dimension": "consistency",
      "explanation": "implementation, detailedImplementation (streamstats or transaction de-duplication) and visualization (distinct faulting hosts in 15 minutes) rely on fields and steps the SPL does not contain.",
      "field": "cross_field",
      "quote": "into a consistent `alarm_text` or CIM-friendly field",
      "severity": "minor",
      "suggested_fix": "Make the SPL produce `alarm_text` and the counts used by the panels, or trim the text."
    },
    {
      "confidence": 0.6,
      "dimension": "specificity",
      "explanation": "Embeds the UC ID in the saved-search name and appears to misspell APC as APIC.",
      "field": "evidence",
      "quote": "UC_15_1_31_APICoolingFault",
      "severity": "minor",
      "suggested_fix": "Use a descriptive name such as apc_inrow_cooling_fault_traps."
    },
    {
      "confidence": 0.55,
      "dimension": "specificity",
      "explanation": "A generic SNMP protocol RFC does not support APC InRow alarm OIDs. No reference covers the APC cooling MIB objects the UC depends on.",
      "field": "references",
      "quote": "IETF RFC 3416 — SNMP Protocol Operations",
      "severity": "minor",
      "suggested_fix": "Add the APC InRow or NetShelter MIB documentation."
    }
  ],
  "firewalled_field_flags": [
    {
      "field": "spl",
      "issue": "The title says fault alarms, but the search matches any trap text containing cooling, fan, InRow, airflow or environmental, with no severity or alarm-state filter. Restoration, informational and normal-state traps would match too.",
      "severity": "major"
    },
    {
      "field": "spl",
      "issue": "`trapoid=\"*318*\"` matches any OID containing 318 anywhere, not just the APC enterprise prefix 1.3.6.1.4.1.318. Also, `index=power` is used for cooling events although the guide lists a `cooling` index and an `snmp:crac` sourcetype for cooling units.",
      "severity": "needs_verification"
    }
  ],
  "model": "claude-sonnet-5-5@reasoning=high",
  "reviewed_at": "2026-10-26T16:53:11Z",
  "rubric_version": "1.0",
  "run_id": "file:triage-0004-UC-15.1.25",
  "schema_version": "1.0",
  "scores": {
    "clarity": 2,
    "consistency": 2,
    "correctness": 3,
    "grandma_fidelity": 1,
    "overclaiming": 3,
    "specificity": 3
  },
  "summary": "A detailed APC InRow trap UC whose description carries template residue and a truncated filter, whose SNMP object and parser settings need verification, and whose keyword filter is looser than the title.",
  "tier": "triage",
  "uc_id": "UC-15.1.31",
  "verdict": "rewrite"
}
