{
  "confidence": 0.9,
  "content_sha256": "a86a79f629c136016dd73ced98d8c923e4fe1e9704d0f299f69bc4708b240ec8",
  "file": "content/cat-05-network-infrastructure/UC-5.8.30.json",
  "findings": [
    {
      "confidence": 0.95,
      "dimension": "clarity",
      "explanation": "The prose filter description contains a dangling 'OR ' where the keyword 'critical' was truncated.",
      "field": "description",
      "quote": "restart OR stopped OR failed OR \\\"Named\\\" OR \\\"DNS Service\\\" OR ",
      "severity": "minor",
      "suggested_fix": "Complete the filter string to match the SPL: 'restart OR stopped OR failed OR \"Named\" OR \"DNS Service\" OR critical'."
    }
  ],
  "firewalled_field_flags": [],
  "model": "gemini-3.7-flash@reasoning=medium",
  "reviewed_at": "2026-10-26T16:18:12Z",
  "rubric_version": "1.0",
  "run_id": "file:triage-0062-UC-5.8.4",
  "schema_version": "1.0",
  "scores": {
    "clarity": 2,
    "consistency": 2,
    "correctness": 3,
    "grandma_fidelity": 4,
    "overclaiming": 3,
    "specificity": 1
  },
  "summary": "Core prose fields are templated with synthetic token-salad phrasing and a truncated search filter string, although detailed implementation steps are informative.",
  "tier": "triage",
  "uc_id": "UC-5.8.30",
  "verdict": "polish"
}
